{
  "builder_code_commit": "7d5f731bc7411a368293c09158fa80205ca93955",
  "contract_binding": {
    "contract_id": "decomposition-test-remediation-047dd750572d6807",
    "contract_sha256": "047dd750572d680711bcd4755e81be9b88402e5c2cca9cd6736a2a0df61d38f5"
  },
  "counts": {
    "preserved_dev_count": 40,
    "remainder_prefix_attempted": 10,
    "remainder_prefix_imported": 10,
    "remainder_prefix_skipped": 0,
    "replacement_test_by_stratum": {
      "exclusion-high": 8,
      "exclusion-low": 5,
      "exclusion-medium": 7,
      "inclusion-high": 8,
      "inclusion-low": 5,
      "inclusion-medium": 7
    },
    "replacement_test_count": 40,
    "replacement_test_trials": 10,
    "retired_test_count": 40
  },
  "dev_records": [
    {
      "complexity": {
        "connector": true,
        "length_points": 2,
        "negation": false,
        "numeric_or_comparator": false,
        "score": 3,
        "temporal": false,
        "tier": "medium",
        "unicode_codepoints": 167
      },
      "criterion_id": "nct02932007-exclusion-04393439bf6f2032",
      "criterion_type": "exclusion",
      "eligibility_sha256": "b4cf469ca0bd086b9706ec8a1c7ae8e26adb25ddeecefd97b19b586beeba6e10",
      "nct_id": "NCT02932007",
      "normalized_text_sha256": "714758ff4953069b163510b39e73c5cd13bde0da5596282392b3e28bf4c95938",
      "protocol_sha256": "9ab7e5ab649589927545e06dbc10b6dde12a75499ca2224696dd505643752ca5",
      "source_record_version": "2019-08-19:b4cf469ca0bd",
      "source_span_length": 167,
      "source_text_sha256": "5896120c9a092b6eecd7dae5a2e4dae350527b9c70281fe395f8f8604df84df7",
      "status": "preserved_dev"
    },
    {
      "complexity": {
        "connector": true,
        "length_points": 2,
        "negation": false,
        "numeric_or_comparator": true,
        "score": 5,
        "temporal": true,
        "tier": "high",
        "unicode_codepoints": 204
      },
      "criterion_id": "nct02932007-inclusion-3449060b23561f00",
      "criterion_type": "inclusion",
      "eligibility_sha256": "b4cf469ca0bd086b9706ec8a1c7ae8e26adb25ddeecefd97b19b586beeba6e10",
      "nct_id": "NCT02932007",
      "normalized_text_sha256": "59e731a7fc3c30e644bcef8945559fa8aaffa1724a7768f7d57854fe038022af",
      "protocol_sha256": "9ab7e5ab649589927545e06dbc10b6dde12a75499ca2224696dd505643752ca5",
      "source_record_version": "2019-08-19:b4cf469ca0bd",
      "source_span_length": 204,
      "source_text_sha256": "5f13afa995d46a2517807869d8b0d11d0b14f44707ae83d9a728df06d2fb2d72",
      "status": "preserved_dev"
    },
    {
      "complexity": {
        "connector": true,
        "length_points": 2,
        "negation": false,
        "numeric_or_comparator": true,
        "score": 5,
        "temporal": true,
        "tier": "high",
        "unicode_codepoints": 322
      },
      "criterion_id": "nct02932007-inclusion-9fa662d9d6bd53f7",
      "criterion_type": "inclusion",
      "eligibility_sha256": "b4cf469ca0bd086b9706ec8a1c7ae8e26adb25ddeecefd97b19b586beeba6e10",
      "nct_id": "NCT02932007",
      "normalized_text_sha256": "5470e82981acf510143281a3fefa541d3a461456bcabfdb2a262d016bd8eb73f",
      "protocol_sha256": "9ab7e5ab649589927545e06dbc10b6dde12a75499ca2224696dd505643752ca5",
      "source_record_version": "2019-08-19:b4cf469ca0bd",
      "source_span_length": 322,
      "source_text_sha256": "99fee5b70301289ff11244299d28b9e00f80648e2b738356ca60b74b7e0c0ea1",
      "status": "preserved_dev"
    },
    {
      "complexity": {
        "connector": false,
        "length_points": 1,
        "negation": false,
        "numeric_or_comparator": false,
        "score": 2,
        "temporal": true,
        "tier": "medium",
        "unicode_codepoints": 156
      },
      "criterion_id": "nct02932007-inclusion-a87b29150a5fc629",
      "criterion_type": "inclusion",
      "eligibility_sha256": "b4cf469ca0bd086b9706ec8a1c7ae8e26adb25ddeecefd97b19b586beeba6e10",
      "nct_id": "NCT02932007",
      "normalized_text_sha256": "b3cf698efd3ecda8ea330ce358caf8facd5aad385d218dc880762aa07d81fc11",
      "protocol_sha256": "9ab7e5ab649589927545e06dbc10b6dde12a75499ca2224696dd505643752ca5",
      "source_record_version": "2019-08-19:b4cf469ca0bd",
      "source_span_length": 156,
      "source_text_sha256": "2a8be07f4e29822093d09fc1dfaa2ab7531921efb2df470a965cbc1367bc3426",
      "status": "preserved_dev"
    },
    {
      "complexity": {
        "connector": true,
        "length_points": 2,
        "negation": true,
        "numeric_or_comparator": true,
        "score": 6,
        "temporal": true,
        "tier": "high",
        "unicode_codepoints": 199
      },
      "criterion_id": "nct02932007-inclusion-ce4fe9d7f97194cb",
      "criterion_type": "inclusion",
      "eligibility_sha256": "b4cf469ca0bd086b9706ec8a1c7ae8e26adb25ddeecefd97b19b586beeba6e10",
      "nct_id": "NCT02932007",
      "normalized_text_sha256": "5abee309222d966465d86b5c3ef21ade30d16204c21d9ce61417ffb84fd8ffa0",
      "protocol_sha256": "9ab7e5ab649589927545e06dbc10b6dde12a75499ca2224696dd505643752ca5",
      "source_record_version": "2019-08-19:b4cf469ca0bd",
      "source_span_length": 199,
      "source_text_sha256": "1f624909ac1ca9a0138f48126a8e5166e628269c57926d7c2e91a8dce0ad1a6b",
      "status": "preserved_dev"
    },
    {
      "complexity": {
        "connector": false,
        "length_points": 1,
        "negation": true,
        "numeric_or_comparator": false,
        "score": 2,
        "temporal": false,
        "tier": "medium",
        "unicode_codepoints": 96
      },
      "criterion_id": "nct05136131-exclusion-2f16526f17fb2859",
      "criterion_type": "exclusion",
      "eligibility_sha256": "42a8201cb6a7c38bd57fc5e82323b7e34c488f544ca55978ab5cb9c2bd74301a",
      "nct_id": "NCT05136131",
      "normalized_text_sha256": "30543508a95ff24465ac19bb8cdca9d4bf4beefebae77adc9999594fc1ba8890",
      "protocol_sha256": "56f2a93e95b2c45d94d0682bd5b56242e525fb59a2c630ba7a85440b608c7e7f",
      "source_record_version": "2026-07-01:42a8201cb6a7",
      "source_span_length": 96,
      "source_text_sha256": "8813cbb65dc9fbe9c201a4f633b84cb9d1a0f4ccd9ea5823d87c502d8dc9df9f",
      "status": "preserved_dev"
    },
    {
      "complexity": {
        "connector": false,
        "length_points": 0,
        "negation": false,
        "numeric_or_comparator": false,
        "score": 0,
        "temporal": false,
        "tier": "low",
        "unicode_codepoints": 24
      },
      "criterion_id": "nct05860894-inclusion-83b4b84c3a0bc30e",
      "criterion_type": "inclusion",
      "eligibility_sha256": "a338254941c90c284c465491e5d60606208e355e0e1670cfc8aaaa1319dd9a7c",
      "nct_id": "NCT05860894",
      "normalized_text_sha256": "d3be1da97636b4011dd9ba2d63f6220e2a0cbab2fcdc7f633c739b49e83654df",
      "protocol_sha256": "41d8fa5387eaf29f0b2d20e9dc5b3f0b8dd5bb032da19ab2eba0361d1a236b41",
      "source_record_version": "2024-02-01:a338254941c9",
      "source_span_length": 24,
      "source_text_sha256": "cba9946e6015f2658a566dea6cb1a68f645891714478adcb8d100e2f55d8a1ce",
      "status": "preserved_dev"
    },
    {
      "complexity": {
        "connector": false,
        "length_points": 0,
        "negation": false,
        "numeric_or_comparator": true,
        "score": 2,
        "temporal": true,
        "tier": "medium",
        "unicode_codepoints": 14
      },
      "criterion_id": "nct05860894-inclusion-93f9b176abd4e08d",
      "criterion_type": "inclusion",
      "eligibility_sha256": "a338254941c90c284c465491e5d60606208e355e0e1670cfc8aaaa1319dd9a7c",
      "nct_id": "NCT05860894",
      "normalized_text_sha256": "1d1b73210b0cd6c70f8ed50f3ee6171e7ad1fd7f1148c5edaee23fa2677bcde7",
      "protocol_sha256": "41d8fa5387eaf29f0b2d20e9dc5b3f0b8dd5bb032da19ab2eba0361d1a236b41",
      "source_record_version": "2024-02-01:a338254941c9",
      "source_span_length": 14,
      "source_text_sha256": "1a69ea029dbf2869f1581e450b8880a6f1ecb232f23dc92b85ddb5800a361af9",
      "status": "preserved_dev"
    },
    {
      "complexity": {
        "connector": true,
        "length_points": 1,
        "negation": false,
        "numeric_or_comparator": false,
        "score": 3,
        "temporal": true,
        "tier": "medium",
        "unicode_codepoints": 107
      },
      "criterion_id": "nct06007872-exclusion-8a27abac4e0b299a",
      "criterion_type": "exclusion",
      "eligibility_sha256": "1e861dba3047f5bfaf43b237aab9bd304e6b49c6949c8b531edb63bf29e34c09",
      "nct_id": "NCT06007872",
      "normalized_text_sha256": "492d23923bc18e34fd52e478d97f18ed2bb7c43181655351016a7edef1970172",
      "protocol_sha256": "bddc80768ce96c2849e35bc3d670229150dbcdbeb5070405fbc10b427c590df0",
      "source_record_version": "2025-10-21:1e861dba3047",
      "source_span_length": 107,
      "source_text_sha256": "fb6b462fbeb528954b587651492e47976a03dcfa1c7597201e8441fad4dd2e82",
      "status": "preserved_dev"
    },
    {
      "complexity": {
        "connector": true,
        "length_points": 1,
        "negation": true,
        "numeric_or_comparator": false,
        "score": 3,
        "temporal": false,
        "tier": "medium",
        "unicode_codepoints": 148
      },
      "criterion_id": "nct06007872-inclusion-e280adfc0698a565",
      "criterion_type": "inclusion",
      "eligibility_sha256": "1e861dba3047f5bfaf43b237aab9bd304e6b49c6949c8b531edb63bf29e34c09",
      "nct_id": "NCT06007872",
      "normalized_text_sha256": "1e059e8cb1ef150dfbd441cb7a511a50802f6c7bb6358826650e8050a9996903",
      "protocol_sha256": "bddc80768ce96c2849e35bc3d670229150dbcdbeb5070405fbc10b427c590df0",
      "source_record_version": "2025-10-21:1e861dba3047",
      "source_span_length": 148,
      "source_text_sha256": "720d8ed6754cb9072ae2e54bf0e499bd56421633e82372a8bb01b4022576e74d",
      "status": "preserved_dev"
    },
    {
      "complexity": {
        "connector": false,
        "length_points": 0,
        "negation": false,
        "numeric_or_comparator": true,